{
  "cells": [
    {
      "capture_points": {
        "ns3_external_egress": "ns3.uav1.egress",
        "ns3_external_ingress": "ns3.cp.ingress",
        "remote_after_adapter": "uav1.mavproxy.tail",
        "source_before_adapter": "cp.source.eth0"
      },
      "cell_id": "uav1.control.downlink",
      "destination": {
        "interface": "eth0",
        "ip": "10.71.1.10",
        "mavlink_component_id": 1,
        "mavlink_system_id": 1,
        "namespace": "ams-uav1",
        "role": "uav1",
        "udp_port": 14601
      },
      "direction": "downlink",
      "identity": {
        "flow_id": "uav1.control.downlink",
        "hash_domains": {
          "application_unit_sha256": true,
          "mavlink_frame_sha256": true,
          "transport_payload_sha256": true,
          "wire_frame_sha256": true
        },
        "nonce_domain": "ams/v1/uav1/control/downlink",
        "sequence_policy": "strictly_monotonic_per_flow"
      },
      "ns3_path": {
        "directed_link_id": "cp>uav1",
        "dscp_tos": 184,
        "egress_device_id": "uav1.tap.egress",
        "egress_udp_port": 16601,
        "ingress_device_id": "cp.tap.ingress",
        "ingress_udp_port": 15601,
        "priority": 0,
        "queue_id": "cp>uav1.control.q0"
      },
      "outcome": {
        "correlation": "request_hash_command_source_target_window",
        "response_kind": "command_ack_and_requested_telemetry",
        "timeout_ms": 3000
      },
      "protocol": {
        "channel": "mavlink_control",
        "classification_source": "decoded_bytes_port_nonce",
        "kind": "mavlink_v2",
        "message_family": "STATUSTEXT_MARKER_PLUS_COMMAND_LONG"
      },
      "source": {
        "interface": "eth0",
        "ip": "10.71.0.10",
        "mavlink_component_id": 190,
        "mavlink_system_id": 255,
        "namespace": "ams-gcs",
        "role": "command_post",
        "udp_port": 14600
      },
      "traffic_class": "control",
      "transport_ports": {
        "command_post_udp": 14600,
        "ns3_ground_handoff_udp": 15601,
        "ns3_uav_handoff_udp": 16601,
        "uav_udp": 14601
      },
      "uav": {
        "instance": 0,
        "name": "uav1",
        "system_id": 1
      }
    },
    {
      "capture_points": {
        "ns3_external_egress": "ns3.cp.egress",
        "ns3_external_ingress": "ns3.uav1.ingress",
        "remote_after_adapter": "cp.sink.eth0",
        "source_before_adapter": "uav1.mavproxy.tail"
      },
      "cell_id": "uav1.control.uplink",
      "destination": {
        "interface": "eth0",
        "ip": "10.71.0.10",
        "mavlink_component_id": 190,
        "mavlink_system_id": 255,
        "namespace": "ams-gcs",
        "role": "command_post",
        "udp_port": 14600
      },
      "direction": "uplink",
      "identity": {
        "flow_id": "uav1.control.uplink",
        "hash_domains": {
          "application_unit_sha256": true,
          "mavlink_frame_sha256": true,
          "transport_payload_sha256": true,
          "wire_frame_sha256": true
        },
        "nonce_domain": "ams/v1/uav1/control/uplink",
        "sequence_policy": "strictly_monotonic_per_flow"
      },
      "ns3_path": {
        "directed_link_id": "uav1>cp",
        "dscp_tos": 184,
        "egress_device_id": "cp.tap.egress",
        "egress_udp_port": 15601,
        "ingress_device_id": "uav1.tap.ingress",
        "ingress_udp_port": 16601,
        "priority": 0,
        "queue_id": "uav1>cp.control.q0"
      },
      "outcome": {
        "correlation": "request_hash_command_source_target_window",
        "response_kind": "correlated_delivery_at_command_post",
        "timeout_ms": 3000
      },
      "protocol": {
        "channel": "mavlink_control",
        "classification_source": "decoded_bytes_port_nonce",
        "kind": "mavlink_v2",
        "message_family": "COMMAND_ACK_HEARTBEAT_REQUESTED_TELEMETRY"
      },
      "source": {
        "interface": "eth0",
        "ip": "10.71.1.10",
        "mavlink_component_id": 1,
        "mavlink_system_id": 1,
        "namespace": "ams-uav1",
        "role": "uav1",
        "udp_port": 14601
      },
      "traffic_class": "control",
      "transport_ports": {
        "command_post_udp": 14600,
        "ns3_ground_handoff_udp": 15601,
        "ns3_uav_handoff_udp": 16601,
        "uav_udp": 14601
      },
      "uav": {
        "instance": 0,
        "name": "uav1",
        "system_id": 1
      }
    },
    {
      "capture_points": {
        "ns3_external_egress": "ns3.uav1.egress",
        "ns3_external_ingress": "ns3.cp.ingress",
        "remote_after_adapter": "uav1.sink.eth0",
        "source_before_adapter": "cp.source.eth0"
      },
      "cell_id": "uav1.payload.downlink",
      "destination": {
        "interface": "eth0",
        "ip": "10.71.1.10",
        "mavlink_component_id": 191,
        "mavlink_system_id": 1,
        "namespace": "ams-uav1",
        "role": "uav1",
        "udp_port": 14701
      },
      "direction": "downlink",
      "identity": {
        "flow_id": "uav1.payload.downlink",
        "hash_domains": {
          "application_unit_sha256": true,
          "mavlink_frame_sha256": true,
          "transport_payload_sha256": true,
          "wire_frame_sha256": true
        },
        "nonce_domain": "ams/v1/uav1/payload/downlink",
        "sequence_policy": "strictly_monotonic_per_flow"
      },
      "ns3_path": {
        "directed_link_id": "cp>uav1",
        "dscp_tos": 40,
        "egress_device_id": "uav1.tap.egress",
        "egress_udp_port": 16701,
        "ingress_device_id": "cp.tap.ingress",
        "ingress_udp_port": 15701,
        "priority": 1,
        "queue_id": "cp>uav1.payload.q1"
      },
      "outcome": {
        "correlation": "run_nonce_flow_direction_sequence_payload_hash",
        "response_kind": "decoded_tunnel_delivery_at_uav_companion",
        "timeout_ms": 3000
      },
      "protocol": {
        "channel": "mavlink_payload",
        "classification_source": "decoded_bytes_port_nonce",
        "kind": "mavlink_v2",
        "message_family": "MAVLINK_TUNNEL_V2"
      },
      "source": {
        "interface": "eth0",
        "ip": "10.71.0.10",
        "mavlink_component_id": 190,
        "mavlink_system_id": 255,
        "namespace": "ams-gcs",
        "role": "command_post",
        "udp_port": 14700
      },
      "traffic_class": "payload",
      "transport_ports": {
        "command_post_udp": 14700,
        "ns3_ground_handoff_udp": 15701,
        "ns3_uav_handoff_udp": 16701,
        "uav_udp": 14701
      },
      "uav": {
        "instance": 0,
        "name": "uav1",
        "system_id": 1
      }
    },
    {
      "capture_points": {
        "ns3_external_egress": "ns3.cp.egress",
        "ns3_external_ingress": "ns3.uav1.ingress",
        "remote_after_adapter": "cp.sink.eth0",
        "source_before_adapter": "uav1.source.eth0"
      },
      "cell_id": "uav1.payload.uplink",
      "destination": {
        "interface": "eth0",
        "ip": "10.71.0.10",
        "mavlink_component_id": 190,
        "mavlink_system_id": 255,
        "namespace": "ams-gcs",
        "role": "command_post",
        "udp_port": 14700
      },
      "direction": "uplink",
      "identity": {
        "flow_id": "uav1.payload.uplink",
        "hash_domains": {
          "application_unit_sha256": true,
          "mavlink_frame_sha256": true,
          "transport_payload_sha256": true,
          "wire_frame_sha256": true
        },
        "nonce_domain": "ams/v1/uav1/payload/uplink",
        "sequence_policy": "strictly_monotonic_per_flow"
      },
      "ns3_path": {
        "directed_link_id": "uav1>cp",
        "dscp_tos": 40,
        "egress_device_id": "cp.tap.egress",
        "egress_udp_port": 15701,
        "ingress_device_id": "uav1.tap.ingress",
        "ingress_udp_port": 16701,
        "priority": 1,
        "queue_id": "uav1>cp.payload.q1"
      },
      "outcome": {
        "correlation": "run_nonce_flow_direction_sequence_payload_hash",
        "response_kind": "decoded_tunnel_delivery_at_command_post",
        "timeout_ms": 3000
      },
      "protocol": {
        "channel": "mavlink_payload",
        "classification_source": "decoded_bytes_port_nonce",
        "kind": "mavlink_v2",
        "message_family": "MAVLINK_TUNNEL_V2"
      },
      "source": {
        "interface": "eth0",
        "ip": "10.71.1.10",
        "mavlink_component_id": 191,
        "mavlink_system_id": 1,
        "namespace": "ams-uav1",
        "role": "uav1",
        "udp_port": 14701
      },
      "traffic_class": "payload",
      "transport_ports": {
        "command_post_udp": 14700,
        "ns3_ground_handoff_udp": 15701,
        "ns3_uav_handoff_udp": 16701,
        "uav_udp": 14701
      },
      "uav": {
        "instance": 0,
        "name": "uav1",
        "system_id": 1
      }
    },
    {
      "capture_points": {
        "ns3_external_egress": "ns3.uav1.egress",
        "ns3_external_ingress": "ns3.cp.ingress",
        "remote_after_adapter": "uav1.sink.eth0",
        "source_before_adapter": "cp.source.eth0"
      },
      "cell_id": "uav1.additional_data.downlink",
      "destination": {
        "interface": "eth0",
        "ip": "10.71.1.10",
        "mavlink_component_id": null,
        "mavlink_system_id": null,
        "namespace": "ams-uav1",
        "role": "uav1",
        "udp_port": 14801
      },
      "direction": "downlink",
      "identity": {
        "flow_id": "uav1.additional_data.downlink",
        "hash_domains": {
          "application_unit_sha256": true,
          "mavlink_frame_sha256": false,
          "transport_payload_sha256": true,
          "wire_frame_sha256": true
        },
        "nonce_domain": "ams/v1/uav1/additional_data/downlink",
        "sequence_policy": "strictly_monotonic_per_flow"
      },
      "ns3_path": {
        "directed_link_id": "cp>uav1",
        "dscp_tos": 0,
        "egress_device_id": "uav1.tap.egress",